{
  "$id": "https://argus.dev/contracts/impact-evidence-bundle/v1/schema.json",
  "$schema": "https://json-schema.org/draft/2020-12/schema",
  "$ref": "#/$defs/ImpactEvidenceBundleV1",
  "$defs": {
    "RepositoryReference": {
      "type": "object",
      "properties": {
        "provider": {
          "type": "string",
          "enum": [
            "github",
            "gitlab",
            "azure-devops",
            "other"
          ]
        },
        "host": {
          "type": "string",
          "minLength": 1,
          "maxLength": 255,
          "pattern": "^[a-z0-9](?:[a-z0-9.-]*[a-z0-9])?$"
        },
        "providerRepositoryId": {
          "type": "string",
          "minLength": 1,
          "maxLength": 255
        },
        "owner": {
          "type": "string",
          "minLength": 1,
          "maxLength": 255
        },
        "name": {
          "type": "string",
          "minLength": 1,
          "maxLength": 255
        }
      },
      "required": [
        "provider",
        "host",
        "providerRepositoryId",
        "owner",
        "name"
      ],
      "additionalProperties": false,
      "description": "A repository reference anchored by the provider-assigned identity; owner and name are mutable display coordinates."
    },
    "Revision": {
      "anyOf": [
        {
          "type": "object",
          "properties": {
            "algorithm": {
              "anyOf": [
                {
                  "type": "string",
                  "enum": [
                    "git-sha1"
                  ]
                }
              ]
            },
            "digest": {
              "type": "string",
              "pattern": "^[0-9a-f]{40}$"
            }
          },
          "required": [
            "algorithm",
            "digest"
          ],
          "additionalProperties": false
        },
        {
          "type": "object",
          "properties": {
            "algorithm": {
              "anyOf": [
                {
                  "type": "string",
                  "enum": [
                    "git-sha256"
                  ]
                }
              ]
            },
            "digest": {
              "type": "string",
              "pattern": "^[0-9a-f]{64}$"
            }
          },
          "required": [
            "algorithm",
            "digest"
          ],
          "additionalProperties": false
        }
      ],
      "description": "An immutable, normalized Git object revision."
    },
    "CatalogSnapshotReference": {
      "type": "object",
      "properties": {
        "sourceRepository": {
          "$ref": "#/$defs/RepositoryReference"
        },
        "revision": {
          "$ref": "#/$defs/Revision"
        },
        "descriptorApiVersion": {
          "anyOf": [
            {
              "type": "string",
              "enum": [
                "argus.dev/repository-descriptor/v1"
              ]
            }
          ]
        }
      },
      "required": [
        "sourceRepository",
        "revision",
        "descriptorApiVersion"
      ],
      "additionalProperties": false,
      "description": "The immutable repository descriptor observation queried by this result page."
    },
    "ImpactEvidenceProducer": {
      "type": "object",
      "properties": {
        "repository": {
          "$ref": "#/$defs/RepositoryReference"
        },
        "revision": {
          "$ref": "#/$defs/Revision"
        },
        "adapter": {
          "type": "string",
          "minLength": 1,
          "maxLength": 127
        }
      },
      "required": [
        "repository",
        "revision",
        "adapter"
      ],
      "additionalProperties": false,
      "description": "The immutable producer revision and adapter responsible for the evidence bundle."
    },
    "UtcTimestamp": {
      "type": "string",
      "pattern": "^\\d{4}-\\d{2}-\\d{2}T\\d{2}:\\d{2}:\\d{2}(?:\\.\\d{1,9})?Z$",
      "description": "An RFC 3339 instant normalized to UTC with an explicit Z suffix."
    },
    "LocalKey": {
      "type": "string",
      "minLength": 1,
      "maxLength": 63,
      "pattern": "^[a-z][a-z0-9._-]*$",
      "description": "A stable, repository-declared key. It is scoped by its containing repository or parent declaration."
    },
    "ImpactTestIdentity": {
      "type": "object",
      "properties": {
        "testRepository": {
          "type": "object",
          "properties": {
            "provider": {
              "type": "string",
              "enum": [
                "github",
                "gitlab",
                "azure-devops",
                "other"
              ]
            },
            "host": {
              "type": "string",
              "minLength": 1,
              "maxLength": 255,
              "pattern": "^[a-z0-9](?:[a-z0-9.-]*[a-z0-9])?$"
            },
            "providerRepositoryId": {
              "type": "string",
              "minLength": 1,
              "maxLength": 255
            }
          },
          "required": [
            "provider",
            "host",
            "providerRepositoryId"
          ],
          "additionalProperties": false
        },
        "suiteKey": {
          "$ref": "#/$defs/LocalKey"
        },
        "testKey": {
          "$ref": "#/$defs/LocalKey"
        }
      },
      "required": [
        "testRepository",
        "suiteKey",
        "testKey"
      ],
      "additionalProperties": false,
      "description": "A stable test identity within the catalog snapshot."
    },
    "ImpactAssertion": {
      "type": "string",
      "enum": [
        "supports",
        "refutes"
      ],
      "description": "Whether the evidence asserts or contradicts a capability-to-test relationship."
    },
    "ImpactEvidenceType": {
      "type": "string",
      "enum": [
        "explicit",
        "static",
        "dynamic",
        "historical",
        "reviewer-confirmed"
      ],
      "description": "The method that produced one impact observation."
    },
    "ConfidenceBasisPoints": {
      "type": "integer",
      "minimum": 0,
      "maximum": 10000,
      "description": "Producer-specific confidence in basis points. It is evidence metadata, not a universal selection threshold."
    },
    "ImpactObservation": {
      "type": "object",
      "properties": {
        "key": {
          "$ref": "#/$defs/LocalKey"
        },
        "capabilityKey": {
          "$ref": "#/$defs/LocalKey"
        },
        "test": {
          "$ref": "#/$defs/ImpactTestIdentity"
        },
        "assertion": {
          "$ref": "#/$defs/ImpactAssertion"
        },
        "evidenceType": {
          "$ref": "#/$defs/ImpactEvidenceType"
        },
        "confidenceBasisPoints": {
          "$ref": "#/$defs/ConfidenceBasisPoints"
        },
        "rationale": {
          "type": "string",
          "minLength": 1,
          "maxLength": 1024
        }
      },
      "required": [
        "key",
        "capabilityKey",
        "test",
        "assertion",
        "evidenceType",
        "confidenceBasisPoints",
        "rationale"
      ],
      "additionalProperties": false,
      "description": "One immutable, explainable assertion about a capability-to-test relationship."
    },
    "ImpactEvidenceBundleV1": {
      "type": "object",
      "properties": {
        "apiVersion": {
          "anyOf": [
            {
              "type": "string",
              "enum": [
                "argus.dev/impact-evidence-bundle/v1"
              ]
            }
          ]
        },
        "snapshot": {
          "$ref": "#/$defs/CatalogSnapshotReference"
        },
        "producer": {
          "$ref": "#/$defs/ImpactEvidenceProducer"
        },
        "observedAt": {
          "$ref": "#/$defs/UtcTimestamp"
        },
        "expiresAt": {
          "anyOf": [
            {
              "$ref": "#/$defs/UtcTimestamp"
            },
            {
              "type": "null"
            }
          ]
        },
        "observations": {
          "type": "array",
          "items": {
            "$ref": "#/$defs/ImpactObservation"
          },
          "minItems": 1,
          "maxItems": 10000
        }
      },
      "required": [
        "apiVersion",
        "snapshot",
        "producer",
        "observedAt",
        "expiresAt",
        "observations"
      ],
      "additionalProperties": false,
      "title": "Argus impact evidence bundle v1",
      "description": "An immutable producer observation containing capability-to-test assertions for one catalog snapshot."
    }
  }
}
